region,description,avg_house_price,infra_score,nature_score,farm_score,smartfarm_score,remote_score,car_need,youth_score,senior_score
나주시,광주 접근성과 생활 인프라가 좋은 균형형 후보지,8500,92,72,68,84,88,45,80,70
고흥군,"바다와 자연환경, 스마트팜 자원이 강한 후보지",6200,60,95,90,96,62,82,72,76
담양군,광주 접근성과 자연환경이 좋아 관광 창업에 어울리는 지역,7800,74,93,75,70,78,65,74,82
해남군,낮은 주거비와 넓은 농지 기반이 강점인 지역,5300,55,89,95,72,58,88,68,80
순천시,"정원, 생태, 생활 인프라를 함께 갖춘 안정형 후보지",9200,88,88,62,66,86,52,78,84
영암군,산업 일자리와 농업 기반을 함께 볼 수 있는 저예산 후보지,5700,58,78,88,74,60,80,70,74
